{
  "$comment": "回測選股池 — 過去 3 年每週市值前 60 大的聯集，由 twse_pipeline.universe_history 產生，勿手改。sharesOutstandingM = 目前已發行普通股數（百萬股）。",
  "builtAt": "2026-10-01",
  "years": 3,
  "constituents": [
    {
      "code": "2330",
      "name": "台積電",
      "sharesOutstandingM": 25932.37
    },
    {
      "code": "2454",
      "name": "聯發科",
      "sharesOutstandingM": 1604.953
    },
    {
      "code": "2308",
      "name": "台達電",
      "sharesOutstandingM": 2597.543
    },
    {
      "code": "2317",
      "name": "鴻海",
      "sharesOutstandingM": 14075.746
    },
    {
      "code": "3711",
      "name": "日月光投控",
      "sharesOutstandingM": 4470.572
    },
    {
      "code": "2881",
      "name": "富邦金",
      "sharesOutstandingM": 14007.365
    },
    {
      "code": "2303",
      "name": "聯電",
      "sharesOutstandingM": 12570.094
    },
    {
      "code": "1303",
      "name": "南亞",
      "sharesOutstandingM": 7930.822
    },
    {
      "code": "3037",
      "name": "欣興",
      "sharesOutstandingM": 1641.292
    },
    {
      "code": "2408",
      "name": "南亞科",
      "sharesOutstandingM": 3450.206
    },
    {
      "code": "2383",
      "name": "台光電",
      "sharesOutstandingM": 358.321
    },
    {
      "code": "2882",
      "name": "國泰金",
      "sharesOutstandingM": 14669.21
    },
    {
      "code": "3017",
      "name": "奇鋐",
      "sharesOutstandingM": 392.67
    },
    {
      "code": "2382",
      "name": "廣達",
      "sharesOutstandingM": 4107.627
    },
    {
      "code": "2891",
      "name": "中信金",
      "sharesOutstandingM": 19675.933
    },
    {
      "code": "2327",
      "name": "國巨",
      "sharesOutstandingM": 2058.731
    },
    {
      "code": "2412",
      "name": "中華電",
      "sharesOutstandingM": 7757.447
    },
    {
      "code": "2059",
      "name": "川湖",
      "sharesOutstandingM": 95.297
    },
    {
      "code": "2345",
      "name": "智邦",
      "sharesOutstandingM": 561.118
    },
    {
      "code": "3443",
      "name": "創意",
      "sharesOutstandingM": 134.012
    },
    {
      "code": "2887",
      "name": "台新新光金",
      "sharesOutstandingM": 25115.062
    },
    {
      "code": "3653",
      "name": "健策",
      "sharesOutstandingM": 147.204
    },
    {
      "code": "7769",
      "name": "鴻勁",
      "sharesOutstandingM": 179.93
    },
    {
      "code": "2885",
      "name": "元大金",
      "sharesOutstandingM": 13864.396
    },
    {
      "code": "8046",
      "name": "南電",
      "sharesOutstandingM": 646.165
    },
    {
      "code": "6505",
      "name": "台塑化",
      "sharesOutstandingM": 9525.96
    },
    {
      "code": "2360",
      "name": "致茂",
      "sharesOutstandingM": 425.246
    },
    {
      "code": "3008",
      "name": "大立光",
      "sharesOutstandingM": 130.798
    },
    {
      "code": "2344",
      "name": "華邦電",
      "sharesOutstandingM": 4500.0
    },
    {
      "code": "2884",
      "name": "玉山金",
      "sharesOutstandingM": 17723.51
    },
    {
      "code": "2886",
      "name": "兆豐金",
      "sharesOutstandingM": 14833.378
    },
    {
      "code": "2357",
      "name": "華碩",
      "sharesOutstandingM": 742.76
    },
    {
      "code": "2301",
      "name": "光寶科",
      "sharesOutstandingM": 2316.108
    },
    {
      "code": "2890",
      "name": "永豐金",
      "sharesOutstandingM": 14782.169
    },
    {
      "code": "2880",
      "name": "華南金",
      "sharesOutstandingM": 14056.135
    },
    {
      "code": "2395",
      "name": "研華",
      "sharesOutstandingM": 869.046
    },
    {
      "code": "2883",
      "name": "凱基金",
      "sharesOutstandingM": 16974.612
    },
    {
      "code": "3231",
      "name": "緯創",
      "sharesOutstandingM": 3180.052
    },
    {
      "code": "2368",
      "name": "金像電",
      "sharesOutstandingM": 522.933
    },
    {
      "code": "4958",
      "name": "臻鼎-KY",
      "sharesOutstandingM": 1117.534
    },
    {
      "code": "2892",
      "name": "第一金",
      "sharesOutstandingM": 14379.469
    },
    {
      "code": "3189",
      "name": "景碩",
      "sharesOutstandingM": 526.91
    },
    {
      "code": "2603",
      "name": "長榮",
      "sharesOutstandingM": 2165.043
    },
    {
      "code": "3665",
      "name": "貿聯-KY",
      "sharesOutstandingM": 199.578
    },
    {
      "code": "6446",
      "name": "藥華藥",
      "sharesOutstandingM": 422.435
    },
    {
      "code": "3045",
      "name": "台灣大",
      "sharesOutstandingM": 3723.431
    },
    {
      "code": "1301",
      "name": "台塑",
      "sharesOutstandingM": 6365.741
    },
    {
      "code": "1216",
      "name": "統一",
      "sharesOutstandingM": 5682.015
    },
    {
      "code": "5880",
      "name": "合庫金",
      "sharesOutstandingM": 16072.96
    },
    {
      "code": "3481",
      "name": "群創",
      "sharesOutstandingM": 7989.197
    },
    {
      "code": "1326",
      "name": "台化",
      "sharesOutstandingM": 5861.186
    },
    {
      "code": "2379",
      "name": "瑞昱",
      "sharesOutstandingM": 515.513
    },
    {
      "code": "6669",
      "name": "緯穎",
      "sharesOutstandingM": 185.841
    },
    {
      "code": "2449",
      "name": "京元電子",
      "sharesOutstandingM": 1283.882
    },
    {
      "code": "4904",
      "name": "遠傳",
      "sharesOutstandingM": 3607.705
    },
    {
      "code": "6770",
      "name": "力積電",
      "sharesOutstandingM": 4712.081
    },
    {
      "code": "3034",
      "name": "聯詠",
      "sharesOutstandingM": 608.511
    },
    {
      "code": "2801",
      "name": "彰銀",
      "sharesOutstandingM": 12060.197
    },
    {
      "code": "3661",
      "name": "世芯-KY",
      "sharesOutstandingM": 86.305
    },
    {
      "code": "2615",
      "name": "萬海",
      "sharesOutstandingM": 2806.146
    },
    {
      "code": "2002",
      "name": "中鋼",
      "sharesOutstandingM": 15734.861
    },
    {
      "code": "2207",
      "name": "和泰車",
      "sharesOutstandingM": 557.103
    },
    {
      "code": "2313",
      "name": "華通",
      "sharesOutstandingM": 1233.821
    },
    {
      "code": "3036",
      "name": "文曄",
      "sharesOutstandingM": 1270.563
    },
    {
      "code": "2404",
      "name": "漢唐",
      "sharesOutstandingM": 190.587
    },
    {
      "code": "2376",
      "name": "技嘉",
      "sharesOutstandingM": 669.889
    },
    {
      "code": "4938",
      "name": "和碩",
      "sharesOutstandingM": 2675.709
    },
    {
      "code": "2337",
      "name": "旺宏",
      "sharesOutstandingM": 1981.857
    },
    {
      "code": "1519",
      "name": "華城",
      "sharesOutstandingM": 347.469
    },
    {
      "code": "5876",
      "name": "上海商銀",
      "sharesOutstandingM": 4910.219
    },
    {
      "code": "1590",
      "name": "亞德客-KY",
      "sharesOutstandingM": 200.0
    },
    {
      "code": "2618",
      "name": "長榮航",
      "sharesOutstandingM": 5400.444
    },
    {
      "code": "2912",
      "name": "統一超",
      "sharesOutstandingM": 1039.622
    },
    {
      "code": "2356",
      "name": "英業達",
      "sharesOutstandingM": 3587.475
    },
    {
      "code": "6515",
      "name": "穎崴",
      "sharesOutstandingM": 36.445
    },
    {
      "code": "3533",
      "name": "嘉澤",
      "sharesOutstandingM": 112.535
    },
    {
      "code": "2609",
      "name": "陽明",
      "sharesOutstandingM": 3492.104
    },
    {
      "code": "1101",
      "name": "台泥",
      "sharesOutstandingM": 7523.182
    },
    {
      "code": "5871",
      "name": "中租-KY",
      "sharesOutstandingM": 1745.65
    },
    {
      "code": "2834",
      "name": "臺企銀",
      "sharesOutstandingM": 10398.326
    },
    {
      "code": "1605",
      "name": "華新",
      "sharesOutstandingM": 4431.333
    },
    {
      "code": "1504",
      "name": "東元",
      "sharesOutstandingM": 2376.441
    },
    {
      "code": "2324",
      "name": "仁寶",
      "sharesOutstandingM": 4407.147
    },
    {
      "code": "6415",
      "name": "矽力*-KY",
      "sharesOutstandingM": 389.453
    },
    {
      "code": "1402",
      "name": "遠東新",
      "sharesOutstandingM": 5352.875
    },
    {
      "code": "2633",
      "name": "台灣高鐵",
      "sharesOutstandingM": 5628.293
    },
    {
      "code": "1102",
      "name": "亞泥",
      "sharesOutstandingM": 3546.563
    },
    {
      "code": "6919",
      "name": "康霈",
      "sharesOutstandingM": 1557.201
    },
    {
      "code": "5269",
      "name": "祥碩",
      "sharesOutstandingM": 74.156
    },
    {
      "code": "1503",
      "name": "士電",
      "sharesOutstandingM": 520.972
    },
    {
      "code": "2105",
      "name": "正新",
      "sharesOutstandingM": 3241.416
    },
    {
      "code": "2385",
      "name": "群光",
      "sharesOutstandingM": 765.721
    },
    {
      "code": "6409",
      "name": "旭隼",
      "sharesOutstandingM": 88.254
    },
    {
      "code": "1476",
      "name": "儒鴻",
      "sharesOutstandingM": 274.367
    },
    {
      "code": "9910",
      "name": "豐泰",
      "sharesOutstandingM": 987.483
    },
    {
      "code": "6949",
      "name": "沛爾生醫*-創",
      "sharesOutstandingM": 1311.601
    },
    {
      "code": "4763",
      "name": "材料*-KY",
      "sharesOutstandingM": 989.147
    },
    {
      "code": "2540",
      "name": "愛山林",
      "sharesOutstandingM": 944.874
    },
    {
      "code": "8422",
      "name": "可寧衛",
      "sharesOutstandingM": 1358.763
    }
  ]
}
